{
  "schema_version": 1,
  "task_id": "fix",
  "status": "done",
  "changed_files": [
    "wordstat.py"
  ],
  "commit": "0a1b2c3d4e5f",
  "requirements": [
    {
      "id": "REQ-MULTILINE",
      "status": "passed",
      "explanation": "ok",
      "evidence": [
        {
          "path": "logs/green.txt"
        }
      ]
    }
  ],
  "verification": [
    {
      "argv": [
        "python3",
        "-m",
        "unittest"
      ],
      "exit_code": 0
    }
  ],
  "findings": [],
  "blockers": []
}
